{
  "$schema":"https://json-schema.org/draft/2020-12/schema",
  "$id":"knowledge/moomintroll-accessory-set-fact-snapshot.schema.json",
  "type":"object","additionalProperties":false,
  "required":["snapshot_format","snapshot_id","source_id","source_url","retrieved_at","capture_policy","facts","non_claims"],
  "properties":{
    "snapshot_format":{"const":"fact_limited_official_support_snapshot_v1"},
    "snapshot_id":{"const":"tgc_faq_1356_moomintroll_accessory_set_2026_08_17"},
    "source_id":{"const":"source_tgc_faq_1356_moomintroll_accessory_set"},
    "source_url":{"const":"https://thatgamecompany.helpshift.com/hc/en/17-sky-children-of-the-light/faq/1356/"},
    "retrieved_at":{"type":"string","format":"date"},"capture_policy":{"type":"string","minLength":1},
    "facts":{"type":"object","additionalProperties":false,"required":["pack_description_en","included_component_descriptions_en","included_component_values","historical_price_usd","historical_window_start_date","historical_window_end_date"],"properties":{
      "pack_description_en":{"const":"Moomintroll Accessory Set"},
      "included_component_descriptions_en":{"type":"object","additionalProperties":false,"required":["item_moomin_ears","item_moomin_tail"],"properties":{"item_moomin_ears":{"const":"ear accessory"},"item_moomin_tail":{"const":"tail accessory"}}},
      "included_component_values":{"const":["ear accessory","tail accessory"]},
      "historical_price_usd":{"const":11.99},
      "historical_window_start_date":{"const":"2024-10-14"},"historical_window_end_date":{"const":"2024-12-29"}
    }},
    "non_claims":{"type":"array","minItems":1,"items":{"type":"string","minLength":1}}
  }
}
